text,label,type,source,dataset
ftg,1,,role_playing_game,cyberado
Zoé t'es qu'une merde et  tu resteras toujours une merde une grosse une boulette,1,,role_playing_game,cyberado
non ne serai jamais jaloux d’elle elle est grosse,1,,role_playing_game,cyberado
non on arrete pas:') :') :') :') il est grosse,1,,role_playing_game,cyberado
il est grosse c'est pas francais commence par aller revoir tes cours ensuite vient critiqué les autre,1,,role_playing_game,cyberado
on sais qtes folle sale pute,1,,role_playing_game,cyberado
va deterrer tes mort,1,,role_playing_game,cyberado
ZOE EST GROSSE,1,,role_playing_game,cyberado
tg jules,1,,role_playing_game,cyberado
oui on ne casse rien on lui dit la verite elle est grosse,1,,role_playing_game,cyberado
c'est ta mere la chienne michel,1,,role_playing_game,cyberado
apprends à parler déjà grosse conne,1,,role_playing_game,cyberado
Tu vois je me pose une question Zoé comment tu fais pour t'acceepter accepter d'être aussi grosse,1,,role_playing_game,cyberado
comptable de pute entre ta mere et toi,1,,role_playing_game,cyberado
jules bz ta mere salle pd 100 e la photo je la suprilmes,1,,role_playing_game,cyberado
t'aime les bites de noir fait pas genre,1,,role_playing_game,cyberado
jules ftg,1,,role_playing_game,cyberado
cette pute la marrave,1,,role_playing_game,cyberado
sa fammille de pute,1,,role_playing_game,cyberado
alors la con de ta mère,1,,role_playing_game,cyberado
ta mere la reine des putes,1,,role_playing_game,cyberado
sale grosse,1,,role_playing_game,cyberado
michel tg,1,,role_playing_game,cyberado
donc ftg stp,1,,role_playing_game,cyberado
michel que il est derriere son cula zoe donc ftg,1,,role_playing_game,cyberado
j prefere faire la manche que la pute comme ta mere,1,,role_playing_game,cyberado
ftg gros boufon,1,,role_playing_game,cyberado
tg,1,,role_playing_game,cyberado
tg tahan de merde,1,,role_playing_game,cyberado
piste les mes grosses couilles,1,,role_playing_game,cyberado
jules ftg toi,1,,role_playing_game,cyberado
va crevrr,1,,role_playing_game,cyberado
va crever,1,,role_playing_game,cyberado
mdrrrr tg jules tu trahi la honda,1,,role_playing_game,cyberado
tg jim,1,,role_playing_game,cyberado
retourne te faire enculer par un singe,1,,role_playing_game,cyberado
mais tg enft clochard et wsh pas ouèch,1,,role_playing_game,cyberado
Je suis pas grosse,1,,role_playing_game,cyberado
FAT = grosse,1,,role_playing_game,cyberado
fatimah elle est 20fois plus grosse qu'elle,1,,role_playing_game,cyberado
va bouffer ton couscous,1,,role_playing_game,cyberado
ta manger trop de bite,1,,role_playing_game,cyberado
grosse merde,1,,role_playing_game,cyberado
JSUIS UBNE FOLLE MOI TA MERE LA PUTEEEEEEEEEEEEEEEEEEEEEEEEEEEEEEEEEEEEEEEEEEEEE,1,,role_playing_game,cyberado
va bouffer tes mort ké tu parle avec moi,1,,role_playing_game,cyberado
tg brice nique  toi,1,,role_playing_game,cyberado
bande de conne,1,,role_playing_game,cyberado
Va baiser ta mère sale fils de pute,1,,role_playing_game,cyberado
va baiser ta mere jules,1,,role_playing_game,cyberado
t grosse tu bouffe que des macdo,1,,role_playing_game,cyberado
ptdrrr alors si une grosse boule,1,,role_playing_game,cyberado
bon tg tu parles trop,1,,role_playing_game,cyberado
beh oui elle est venu nous parler elle cherche la merde cette grosse,1,,role_playing_game,cyberado
contrairrement a vous salle conne,1,,role_playing_game,cyberado
j'ai des seins vous êtes des grosses jalouse vous avez rien vous,1,,role_playing_game,cyberado
elle au moin elle est pas conne comme vous bande de poufiasse,1,,role_playing_game,cyberado
bah au moins elle est pas plate comme vous bande de conne,1,,role_playing_game,cyberado
bah la mere d'une grosse moche doit etre grosse moche,1,,role_playing_game,cyberado
mais tg toi on est Fat igué,1,,role_playing_game,cyberado
non tg,1,,role_playing_game,cyberado
tgg,1,,role_playing_game,cyberado
tu parles a toi bête grosse conne t tebe,1,,role_playing_game,cyberado
 nan mais boomer change de voc pd,1,,role_playing_game,cyberado
il aime surtout les grosse,1,,role_playing_game,cyberado
t'aime les mecs donc t'aime les grosse,1,,role_playing_game,cyberado
tg elisa,1,,role_playing_game,cyberado
bon vous me dégouter les pd je me casse et allé vous faire soigner,1,,role_playing_game,cyberado
lisa tg stp,1,,role_playing_game,cyberado
tg Camille,1,,role_playing_game,cyberado
toi nike ta mere sallle pute,1,,role_playing_game,cyberado
tg Camille t'es une merde,1,,role_playing_game,cyberado
nicola ftg,1,,role_playing_game,cyberado
silvia tg on a des preuvesx et destémoins,1,,role_playing_game,cyberado
tg toi,1,,role_playing_game,cyberado
ftg toi même,1,,role_playing_game,cyberado
la con de tes motrs,1,,role_playing_game,cyberado
bandes de putes,1,,role_playing_game,cyberado
parle bien de la daronne gros fdp,1,,role_playing_game,cyberado
wallah tg keske tu ouvre ta bouche de suceuse,1,,role_playing_game,cyberado
sa ma dit que tu suce bien en plus avec la video qui a tourner fdp,1,,role_playing_game,cyberado
tg  gros  ouf,1,,role_playing_game,cyberado
et wee hein bien sur wallah au lieux de parler pour rien fdp,1,,role_playing_game,cyberado
ta mere la pute a manger des chips,1,,role_playing_game,cyberado
et ftg friends,1,,role_playing_game,cyberado
bien fait xD c'est toi tes sale jsuis sure qtu suces  la chatte de ta mere,1,,role_playing_game,cyberado
Moussa bz ta mere la voiler,1,,role_playing_game,cyberado
bz ta mere,1,,role_playing_game,cyberado
bz ta mere Yaniss,1,,role_playing_game,cyberado
cb tg toi friend tes mort,1,,role_playing_game,cyberado
tes une petite pute toi,1,,role_playing_game,cyberado
Tg Thérèsa,1,,role_playing_game,cyberado
theo ftg,1,,role_playing_game,cyberado
tg theo la veriter blaisse tu te sens mal,1,,role_playing_game,cyberado
theo ftg vrm tu sers à r,1,,role_playing_game,cyberado
pauline et pierre 2 grosses merdes qui parlent,1,,role_playing_game,cyberado
toi eclater apr contre,1,,role_playing_game,cyberado
oo tg pierre me fais pas chier jmen blc de ta vie franchement,1,,role_playing_game,cyberado
teresa parle bien ftg,1,,role_playing_game,cyberado
ooo nicolas tg,1,,role_playing_game,cyberado
nikez vos darons bande de pd,1,,role_playing_game,cyberado
tu vois c'est toi la pute maintenant nicolas,1,,role_playing_game,cyberado
ptddrrr tg pierre tu viens au foot apres?,1,,role_playing_game,cyberado
Si le savoir est une arme et bas bz ta mère,1,,role_playing_game,cyberado
alors jvous bz tous,1,,role_playing_game,cyberado
baiser vous bande de putes,1,,role_playing_game,cyberado
vous êtes tous mes putes,1,,role_playing_game,cyberado
paupau tg et l'autre autre kiss kiss,1,,role_playing_game,cyberado
tu vas contaminer tout le monde paul !!!!!!!,1,,role_playing_game,cyberado
Eh vzy 1v1 demain julie jv bz,1,,role_playing_game,cyberado
et toi retourne en enfer sal epute de julie,1,,role_playing_game,cyberado
sale boufonne parle mieux,1,,role_playing_game,cyberado
non avec toi on perd jamais notre temps sale boufon,1,,role_playing_game,cyberado
suce ma bite jules,1,,role_playing_game,cyberado
ton  corps il contient 90% de tartiflette sale chien,1,,role_playing_game,cyberado
grosse gamine ouèch,1,,role_playing_game,cyberado
le traite pas de puceau y ta bz dans les chiotte,1,,role_playing_game,cyberado
ptdrrrr commee ta mere l'andicape,1,,role_playing_game,cyberado
aller tg,1,,role_playing_game,cyberado
toujours etait une pute de mere en fille,1,,role_playing_game,cyberado
Salut les cons!,1,,role_playing_game,cyberado
hey! tu m'parle autrement la grosse!,1,,role_playing_game,cyberado
t kune pute,1,,role_playing_game,cyberado
hey quand y a une pute faut faire profiter!,1,,role_playing_game,cyberado
soit contente la grosse,1,,role_playing_game,cyberado
sale trdc perdu,1,,role_playing_game,cyberado
et pour aimer ton cul faurdrait etre aveugle la grosse,1,,role_playing_game,cyberado
c oi la pute et tu m parle pas comme ca,1,,role_playing_game,cyberado
vien te nike ta grand mere kehba,1,,role_playing_game,cyberado
GROSSE folle,1,,role_playing_game,cyberado
Et ta mere elle peut courir 2sec aussi sans etre essoufles?,1,grossophobie,role_playing_game,cyberado
julie ftg,1,,role_playing_game,cyberado
tu nike ta mere plutot et encore,1,,role_playing_game,cyberado
donc il kif les grosses moches,1,,role_playing_game,cyberado
ouais c ca la pute,1,,role_playing_game,cyberado
c ca allez ciao les gosses putes,1,,role_playing_game,cyberado
retournez dans votre ferme traire vos meres,1,,role_playing_game,cyberado
 tu va rien faire sal;e folle,1,,role_playing_game,cyberado
sa ser a rien de le défendre t qune pute assumee suceuse,1,,role_playing_game,cyberado
qu'est qu'elle a l'autre rousse? tu défend les putes,1,,role_playing_game,cyberado
moi silvia on est les plus belle bande de fdp,1,,role_playing_game,cyberado
le con de tes mortttttttt soan t une pute tfacon t la plus gross victime,1,,role_playing_game,cyberado
retourne sucer des bite,1,,role_playing_game,cyberado
jmange ta mere surtout,1,,role_playing_game,cyberado
il a des grosses cuisses Moussa,1,,role_playing_game,cyberado
MOI JVOUS BZ MOI,1,,role_playing_game,cyberado
ce n'est pas de ca faute d'avoir des grosses cuisses,1,,role_playing_game,cyberado
tu va repartir en boiten,1,,role_playing_game,cyberado
aller niquez vos mere,1,,role_playing_game,cyberado
Et toi fils de pute,1,,role_playing_game,cyberado
enculer de merde j'espere que zemmour passe,1,,role_playing_game,cyberado
Zemoour ce gros pd,1,,role_playing_game,cyberado
gros fils de pute vive Hollande,1,,role_playing_game,cyberado
ta mere la reine des salope,1,,role_playing_game,cyberado
t'as de la chance c le ramadan sinon je t'aurait enculé toi et tt tes morts de fils de pute,1,,role_playing_game,cyberado
uhm regarde ce que je vois c'est Moussa au grosse cuisses,1,,role_playing_game,cyberado
Moussa tg parce que tu vit grasse a mes impot,1,,role_playing_game,cyberado
et  elle ten merde niker vos grand mere,1,,role_playing_game,cyberado
bande de fils de pute,1,,role_playing_game,cyberado
oui c moi gros fdp,1,,role_playing_game,cyberado
Ttg stp,1,,role_playing_game,cyberado
tu va faire quoi avec ton pti corp t solo ta pas dami,1,,role_playing_game,cyberado
j'aime les grosse salpe,1,,role_playing_game,cyberado
ohh vos mere les salope,1,,role_playing_game,cyberado
viens que jte niquer jules petit pd,1,,role_playing_game,cyberado
 Que des putes moi je suis avec toi Brice,1,,role_playing_game,cyberado
cest fdp de racistes zemmourriens,1,,role_playing_game,cyberado
sale chien,1,,role_playing_game,cyberado
non bz t morts david,1,,role_playing_game,cyberado
ta mere me suce les couille Brice,1,,role_playing_game,cyberado
tu pouvais juste ne pas l'embrasser c'est ta faute boulette,1,,role_playing_game,cyberado
t'es une pute t'as trahi ta camarde,1,,role_playing_game,cyberado
C'est votre pote la pute ici,1,,role_playing_game,cyberado
tg t’as pas le droit a la parole Soan,1,,role_playing_game,cyberado
bien dit Diana ! tg,1,,role_playing_game,cyberado
cul de crasseuse,1,,role_playing_game,cyberado
Les conneries d'Adrien sont aussi grosses que lui,1,,role_playing_game,cyberado
tg petasse,1,,role_playing_game,cyberado
je comprend meme pas pq il t’as embrasse sophi est pas grosse au moins,1,,role_playing_game,cyberado
soyez intelligent Adrien tg,1,,role_playing_game,cyberado
t'es une pute et tu resteras toujours une pute,1,,role_playing_game,cyberado
oh Diana tu parles trop tu fais de la peine p’tite pute,1,,role_playing_game,cyberado
et laisse silvia et lucas faire leur vie mais bz ta mère,1,,role_playing_game,cyberado
hebert tg toi,1,,role_playing_game,cyberado
Sale mouton Diana,1,,role_playing_game,cyberado
"mais vous allez trop loin,  vous dites n'importes quoi alors vous méritez les deux connasses",1,,role_playing_game,cyberado
apprend a écrire connasse,1,,role_playing_game,cyberado
questuveux toi ferme la,1,,role_playing_game,cyberado
ferme ta gueule soan avec tes questions philosophiques à la con,1,,role_playing_game,cyberado
on est content pour toi mais juste ferme la,1,,role_playing_game,cyberado
martinz la connasse,1,,role_playing_game,cyberado
"tu m'étonnes que vous l'avez vue,  c'est vous qu'il l'avez prises connasses",1,,role_playing_game,cyberado
ferme la Brice,1,,role_playing_game,cyberado
alors on ferme sa gueule,1,,role_playing_game,cyberado
petite bite,1,,role_playing_game,cyberado
coralie ferme ta gueule toi aussi t'es une petasse,1,,role_playing_game,cyberado
t conne,1,,role_playing_game,cyberado
ou ou ou je m'appel Paul j'aime les bite,1,,role_playing_game,cyberado
c'est mes morts qui te sucent julie,1,,role_playing_game,cyberado
mais ferme la ta  vu ta gueule,1,,role_playing_game,cyberado
quand tu fermeras ta gueule,1,,role_playing_game,cyberado
ferme ta gueule demande a ta mere il est pas si petit,1,,role_playing_game,cyberado
jules ferme ta gueule assure,1,,role_playing_game,cyberado
on lui faire sucer des bite,1,,role_playing_game,cyberado
allez fermez la,1,,role_playing_game,cyberado
la bite dans la bouche depuis tout à l'heure,1,,role_playing_game,cyberado
personne te la suce la tienne,1,,role_playing_game,cyberado
mais ferme ta gueule ?,1,,role_playing_game,cyberado
je sais ou thabite fais  pas le maline brice ftg,1,,role_playing_game,cyberado
je te crache dessus connard,1,,role_playing_game,cyberado
Amine: il te manque une claque dans la gueule,1,,role_playing_game,cyberado
ferme ton fiac on arrive pas a s'entendre,1,,role_playing_game,cyberado
et toi Diana avec ta gueule de macaque de quoi tu parles?,1,,role_playing_game,cyberado
T'as enfin fermé ta gueule?,1,,role_playing_game,cyberado
fermez vos gueules un peu,1,,role_playing_game,cyberado
ferme la marjorie t'es  qu'une poufiasse sans cervelle,1,,role_playing_game,cyberado
il se suce la bite entre eux,1,,role_playing_game,cyberado
theo on va te meler aussi,1,,role_playing_game,cyberado
suce moi,1,,role_playing_game,cyberado
tg jvais te cracher dessus,1,,role_playing_game,cyberado
le seul truc que jv enflammer c'est tes morts,1,,role_playing_game,cyberado
teresa fais comme fatima ferme la,1,,role_playing_game,cyberado
toi ta gueule,1,,role_playing_game,cyberado
 masi vous etes qui fermer la,1,,role_playing_game,cyberado
et elle ose ouvrir sa bouche de suceuse,1,,role_playing_game,cyberado
allez suce em,1,,role_playing_game,cyberado
oe en auschwitz et il suce hitler,1,,role_playing_game,cyberado
teubé va,1,,role_playing_game,cyberado
TES TELLEMENT GROS QUE QUAND TU PASSE DEVANT LE SOLEIL TOUT LE MONDE CRIS ECLIPSE!!!!!!!!,1,,role_playing_game,cyberado
tu veux que je t'explose ta gueule ou quoi?,1,,role_playing_game,cyberado
eux ils sucent pas des grosses bites a longueur de journee,1,,role_playing_game,cyberado
ecpece d'usine a bite,1,,role_playing_game,cyberado
teresa ftg va a l'eglise,1,,role_playing_game,cyberado
ta gueule tu defends une salope,1,,role_playing_game,cyberado
« +1 herbert » que tu suce,1,,role_playing_game,cyberado
t'aimes les homme tu dégoute! vas te faire soigner,1,,role_playing_game,cyberado
ta grosse mere la pute je vais tenculer dans ton berceau tume connaispas moi,1,,role_playing_game,cyberado
Oui as part moi connard MDR,1,,role_playing_game,cyberado
jim baiz tes mortd,1,,role_playing_game,cyberado
T mort,1,,role_playing_game,cyberado
Alors julie t'ai dégeulasse de sortir avec une gadji bande de salopes,1,lesbian,role_playing_game,cyberado
elle a aucun respect cette crasseuse,1,,role_playing_game,cyberado
exactement stv on te fait un cour crasseuse,1,,role_playing_game,cyberado
burk bande de chienne,1,,role_playing_game,cyberado
sylvia t vraiment la pire des grosses salope tu savait qu il été en couple est tu la embrassé ta aucun *e race,1,,role_playing_game,cyberado
vous avez pas de forme vous bande jalouse,1,,role_playing_game,cyberado
vous etes qu'une bande de con ceux qui respectent r,1,,role_playing_game,cyberado
bien ditt C'est beaucoup plus beau une fille avec des formes et des kilos en trop qu'une personne plate qui ressemble a une planche a pain bande de pute,1,,role_playing_game,cyberado
façon j'veux ps d'une crasseuse comme toi,1,,role_playing_game,cyberado
mellez-vous de votre cul,1,,role_playing_game,cyberado
grave pas de crasseuse,1,,role_playing_game,cyberado
"Jim: fais gaffe à ton cul alors,  je pourrais peut etre sauter sur toi..",1,,role_playing_game,cyberado
enculé,1,,role_playing_game,cyberado
même une aveugle cul de jatte serait pas excitée par toi,1,,role_playing_game,cyberado
moi jai enculé ta darronne la salope,1,,role_playing_game,cyberado
les gars vous perdez votre temps a vous insulter comme ca vous  vous faite du mal les un avec les autres faite la paix ou vous calculer plus,1,,role_playing_game,cyberado
suicide toi brice et fais nous un tuto quand tu va te pendre,1,,role_playing_game,cyberado
mais jules clochard gros cul de merde,1,,role_playing_game,cyberado
Je voudrais qu'on arrête de se moquer de moi et ma culture,1,,role_playing_game,cyberado
j'ai vu le cul de ta soeur,1,,role_playing_game,cyberado
tout le monde a vu ton cul,1,,role_playing_game,cyberado
ça surcule avec tous les mecs qui ton dé glingué,1,,role_playing_game,cyberado
occupe toi de ton cul,1,,role_playing_game,cyberado
ils ont mal au cul trnql,1,,role_playing_game,cyberado
Ellian la merde ca sort du cul pas de la bouche,1,,role_playing_game,cyberado
theo: fais gaffe a ton cul,1,,role_playing_game,cyberado
la pauline on voyait son cul et elle vient m harceler apres la,1,,role_playing_game,cyberado
tu es de son côté alors qu'elle traine son cul sale partout ou ya des mecs,1,,role_playing_game,cyberado
ohhhh viens essaie mon cul il s'ouvre pas pour toi dsl,1,,role_playing_game,cyberado
Je v vs boter le cul,1,,role_playing_game,cyberado
saloperie,1,,role_playing_game,cyberado
salope,1,,role_playing_game,cyberado
salope,1,,role_playing_game,cyberado
coralie et fatimah c'est des salopes,1,,role_playing_game,cyberado
salope ! tu t vu ?,1,,role_playing_game,cyberado
on arrete rien du tout pk elle assume pas cette salopeee,1,,role_playing_game,cyberado
tu sais de quoi je parle salope,1,,role_playing_game,cyberado
grosse crasseuse,1,,role_playing_game,cyberado
mais assumer vous degouter bande de crasseuse,1,,role_playing_game,cyberado
tg Soan t'es au meme niveau que ta pote crasseuse,1,,role_playing_game,cyberado
brice suce ma bite,1,,role_playing_game,cyberado
bande de sombre pute lucas arrete de faire le beau avec ta petite bite,1,,role_playing_game,cyberado
arrete de faire la mskn Brice assume ta ptite bite,1,,role_playing_game,cyberado
vous puez de la shnek bande de crasseuse,1,,role_playing_game,cyberado
allez diminue vos grossse bite cest mieux,1,,role_playing_game,cyberado
lvdm assume saliope,1,,role_playing_game,cyberado
elles vont voir ce que c de ce faire peter le q,1,,role_playing_game,cyberado
mec quand tu sautes tu provoques un séisme sur toute la terre,1,,role_playing_game,cyberado
Soan ptite pute Soan arrete de pomper a tout va,1,,role_playing_game,cyberado
silvia on va debarquer chez toi tu vas voir,1,,role_playing_game,cyberado
ces ton pere qui la pomper comme toi avec les mecs!!!!!!!!!!!!!!!!,1,,role_playing_game,cyberado
ton père plein de mst il met autre chose dans des trous,1,,role_playing_game,cyberado
laisse-moi vivre ou je t'écrase,1,,role_playing_game,cyberado
vous êtes des merdes à la défendre tous,1,,role_playing_game,cyberado
c sur que ecraser des personnes ca doit etre facile pour toi vue que yu pese 1 tonne,1,grossphobie,role_playing_game,cyberado
allez casse vous un peu,1,,role_playing_game,cyberado
mais c'est toi la bouffone nn mais je reve,1,,role_playing_game,cyberado
bien dit zoé rouller aplati le,1,,role_playing_game,cyberado
ahhh sayer zoe ouvre sa gueuele ahahah,1,,role_playing_game,cyberado
OUE GROSPORC,1,,role_playing_game,cyberado
il est ou le mamouth,1,,role_playing_game,cyberado
IL EST OU LE GROS LARD,1,,role_playing_game,cyberado
espece de boule je te pousse tu roule,1,,role_playing_game,cyberado
et oh baleine bleu,1,,role_playing_game,cyberado
ALLEZ MANIFESTE TOI GROS PORCS,1,,role_playing_game,cyberado
brice le cachalot,1,,role_playing_game,cyberado
kehba de merde,1,,role_playing_game,cyberado
kehba de bitch,1,,role_playing_game,cyberado
porte plainte grosse folle sa va te meler,1,,role_playing_game,cyberado
jamais brice le gros lard,1,,role_playing_game,cyberado
C JUSTE ON EST PAS GROSEE PETASSE,1,,role_playing_game,cyberado
gros chien de la casse nique ton pere la salop qui fait le tapin sur les trotoire,1,,role_playing_game,cyberado
wallah me degoute gros trdc,1,,role_playing_game,cyberado
" vous etes de gros malades qui ne supportent pas les autres  c""est trop important de se respecter",1,,role_playing_game,cyberado
Brice t'est telment gros que si on te pousse tu roule,1,,role_playing_game,cyberado
arreter d'insulter se gros de Brice non je rigole,1,,role_playing_game,cyberado
pédale des qu on est triste on va pleuré chez papa pendant qu il se branle,1,,role_playing_game,cyberado
twerke de la graisse,1,,role_playing_game,cyberado
ton vieux nombril,1,,role_playing_game,cyberado
j'ai pas changer jte pisse juste dessus frr,1,,role_playing_game,cyberado
brice si taurai était aussi fort a lécole que dans la muscu tu ressemblerai pas a king kong,1,,role_playing_game,cyberado
il faut que tu t'entraine a sucer les profs pour rammener les bonnes notes,1,,role_playing_game,cyberado
nikomok,1,,role_playing_game,cyberado
tu casse les couilles,1,,role_playing_game,cyberado
oue oue ca va les pds,1,,role_playing_game,cyberado
tu sais nager fat ?N,1,,role_playing_game,cyberado
bolosse,1,,role_playing_game,cyberado
toi dans la tete dans des teub,1,,role_playing_game,cyberado
t'es obese,1,,role_playing_game,cyberado
c'est toi le singe,1,,role_playing_game,cyberado
*retourne manger tes bananes,1,,role_playing_game,cyberado
les merguez t'en prends pas que dans la bouche,1,,role_playing_game,cyberado
et toi tu pu...,1,,role_playing_game,cyberado
Fatigras,1,,role_playing_game,cyberado
ou je vais t’attraper aussi,1,,role_playing_game,cyberado
IL AURAIT DU T'EXTERMINER !,1,,role_playing_game,cyberado
tu t'es suicidé,1,,role_playing_game,cyberado
"Leo et Paul, vous n'êtes que des diarrhées verbales !",1,,role_playing_game,cyberado
ooooow gros FDB je vais te niker tout tes mort wallah grosse suceuse de bite que tu suce . je te revoi a la lib je te descent avec un gros calibre sa mere,1,,role_playing_game,cyberado
c'est toi le bourlet lucie,1,,role_playing_game,cyberado
toi tu ressemble a un anus perimé,1,,role_playing_game,cyberado
Paul t'aime les chibre bien véneux tah les chibrax,1,,role_playing_game,cyberado
t'es nul enfaite,1,,role_playing_game,cyberado
rentre chez toi tu sers a r vrmt degage,1,,role_playing_game,cyberado
bahahaha gay refoulé,1,,role_playing_game,cyberado
t'es un trans  avec tes poils,1,,role_playing_game,cyberado
vive hitler et zemmours,1,,role_playing_game,cyberado
aucun gay ICI CA DEGAGE,1,,role_playing_game,cyberado
elle le fait deja ça sucer les profs,1,,role_playing_game,cyberado
ah sayer zoé tu as tes potes pour te defendrent tu te sens fraiche et t'ouvres ta gueule,1,,role_playing_game,cyberado
jen profiterai pour te baiser,1,,role_playing_game,cyberado
a part sucer jim d'autees talent ?,1,,role_playing_game,cyberado
Sophie tu devrais t'occuper d'Adrien il en peut plus d'agiter la queue$,1,,role_playing_game,cyberado
on va te prendre en moulant,1,,role_playing_game,cyberado
et ta mère !,1,,role_playing_game,cyberado
TRD PERDU WLH ATT QUE JTE VOIE,1,,role_playing_game,cyberado
et wallah ta 10 ans zebiiii,1,,role_playing_game,cyberado
on va te mmeler,1,,role_playing_game,cyberado
on va te faire tournee dans tout le quartier,1,,role_playing_game,cyberado
eh que moi aussi j'te vois et ferme ta bouche,1,,role_playing_game,cyberado
on va te faire manger du saucisson,1,,role_playing_game,cyberado
Alors pk tu le suce tous les soir,1,,role_playing_game,cyberado
on va s'en sortir triomphant on va expulser tous les arabes comme toi,1,,role_playing_game,cyberado
on va pas de sa iciiiii merde,1,,role_playing_game,cyberado
Theresa :quitte a etre une baleine,1,,role_playing_game,cyberado
petasse...,1,,role_playing_game,cyberado
tu peux bien aller te faire foutre,1,,role_playing_game,cyberado
on va pas arreter c que le debut on va t'harceler toute la vie on va venir devant chez toi on va te bz,1,,role_playing_game,cyberado
Les flics c des merdes il nous retrouveront jamais je suis sous VPN MDRRRRRR,1,,role_playing_game,cyberado
mdrrr cest toi le petit puceau fragile qui parle,1,,role_playing_game,cyberado
TU PEUX SAUTER FRANCOIS FAIS TOI PLAISIR,1,,role_playing_game,cyberado
pierre ca te fais pas kiffer de voir ce genre de petites merdes pleurer,1,,role_playing_game,cyberado
on va lui enfoncer une bite dans le cut,1,,role_playing_game,cyberado
tkktt on t'attendra a 2 on te ntm,1,,role_playing_game,cyberado
ntm tu c pa ekrire,1,,role_playing_game,cyberado
Brice nique ta race,1,,role_playing_game,cyberado
on va devoir te coudre la bouche,1,,role_playing_game,cyberado
tbrice tu es une merde,1,,role_playing_game,cyberado
une sacree merde,1,,role_playing_game,cyberado
oh ptn elle vas me rouler dessus je vais câner,1,,role_playing_game,cyberado
non reste je vais te demonte ta gueule qui suce des bites,1,,role_playing_game,cyberado
En plus d'etre une  aguicheusse de merde tu es une menteuse,1,,role_playing_game,cyberado
natacha elle va mourir si tu lui roulle dessus t'as t'es 3 ptit klebs,1,,role_playing_game,cyberado
MOUSSA JE VAIS VENIR EN BAS DE CHEZ TOI TU VA VOIR QUI VA PLUS PARLER SALE MIGRANS DE MERDE,1,,role_playing_game,cyberado
Mon poing dans ta gueule va etre tout aussi drole Théo,1,,role_playing_game,cyberado
c'est ça ton excuse de merde?,1,,role_playing_game,cyberado
un petit porc mdrrr bien trouver les deux bouffones elles t'emmerdent,1,,role_playing_game,cyberado
zoé t'emmerde,1,,role_playing_game,cyberado
